<?xml version="1.0"?>
<!DOCTYPE Report
[
<!ELEMENT Report (General ,(Doc|BPT)) >
<!ATTLIST Report ver CDATA #REQUIRED tmZone CDATA #REQUIRED>

<!ELEMENT General ( DocLocation ) >
<!ATTLIST General productName CDATA #REQUIRED productVer CDATA #REQUIRED os CDATA #REQUIRED host CDATA #REQUIRED qcserver CDATA #IMPLIED qcproject CDATA #IMPLIED SolManSolutionId CDATA #IMPLIED SolManProjectId CDATA #IMPLIED SolManTestPlanId CDATA #IMPLIED SolManTestPackageId CDATA #IMPLIED SolManUserInfoData CDATA #IMPLIED  >

<!ELEMENT BPT (DName,Res,DVer?,TSet?,TInst?,NodeArgs,AdditionalInfo*,Doc*) >
<!ATTLIST BPT rID ID #REQUIRED >

<!ELEMENT Doc (DName,ConfName?,Res,DVer?,TSet?,TInst?,RunType?,DT?,AdditionalInfo*,Step*,DIter*,Step*,Action*,Doc*,Summary?,TestMaintenanceSummary*,NodeArgs?) >
<!ATTLIST Doc rID ID #REQUIRED type (Test|BC|BPTWrapperTest|Flow|Group|Action) "Test" productName CDATA #REQUIRED BCIter CDATA #IMPLIED >

<!ELEMENT RunType ( #PCDATA )>
<!ATTLIST RunType fmStep (False|True) "False" batch (False|True) "False" upDesc (False|True) "False" upChk (False|True) "False" upAS (False|True) "False">

<!ELEMENT DName ( #PCDATA ) >

<!ELEMENT ConfName ( #PCDATA ) >

<!ELEMENT Res ( #PCDATA ) >

<!ELEMENT AdditionalInfo (AdditionalDataName,AdditionalDataValue ) >

<!ELEMENT AdditionalDataName ( #PCDATA ) >

<!ELEMENT AdditionalDataValue ( #PCDATA ) >

<!ELEMENT DVer ( #PCDATA ) >

<!ELEMENT TSet ( #PCDATA ) >

<!ELEMENT TInst ( #PCDATA ) >

<!ELEMENT DIter (Step*,Action+,Summary?,NodeArgs)>
<!ATTLIST DIter rID ID #REQUIRED iterID CDATA #REQUIRED>

<!ELEMENT DocLocation ( #PCDATA )>

<!ELEMENT Action (AName,AIter*,(Step|HtmlStep|Action)*, Summary,ActionMaintenanceSummary*, NodeArgs ) >
<!ATTLIST Action rID ID #REQUIRED>

<!ELEMENT AIter ((Step|HtmlStep|Action)*,DataMapping?, Summary?,NodeArgs) >
<!ATTLIST AIter rID ID #REQUIRED iterID CDATA #REQUIRED isCountable (False|True) "False" >

<!ELEMENT AName ( #PCDATA ) >

<!ELEMENT TestMaintenanceSummary (ActionMaintenanceSummary*) >
<!ATTLIST TestMaintenanceSummary ObjectsAdded CDATA #REQUIRED ObjectsUpdated CDATA #REQUIRED StepsUpdated CDATA #REQUIRED StepsComments CDATA #REQUIRED><!ELEMENT ActionMaintenanceSummary (ObjectChange* ) >
<!ATTLIST ActionMaintenanceSummary Action CDATA #REQUIRED Objects CDATA #REQUIRED Updated CDATA #REQUIRED LinesTotal CDATA #REQUIRED Added CDATA #REQUIRED LinesUpdated CDATA #REQUIRED>

<!ELEMENT ObjectChange  (Hierarchy, PropertyChangeList* ) >
<!ATTLIST ObjectChange Operation CDATA #IMPLIED OriginalRepository CDATA #IMPLIED>

<!ELEMENT PropertyChangeList (PropertyDef*) >

<!ELEMENT PropertyDef (OriginalValue, NewValue) >
<!ATTLIST PropertyDef PropName CDATA #REQUIRED OriginRegularExpression (True|False) "False" NewRegularExpression (True|False) "False" AddedProperty (True|False) "False" >

<!ELEMENT OriginalValue ( #PCDATA )>

<!ELEMENT NewValue ( #PCDATA )>

<!ELEMENT Hierarchy  (ObjectName, Hierarchy*) >
<!ATTLIST Hierarchy MicClass CDATA #REQUIRED>

<!ELEMENT ObjectName  ( #PCDATA ) >

<!ELEMENT Step (Obj,Details,Time,TimeTick* ,(Step|HtmlStep|Doc)*, DataMapping?, NodeArgs) >
<!ATTLIST Step rID ID #REQUIRED retval CDATA #IMPLIED>

<!ELEMENT HtmlStep (HTML,TimeTick*,(Step|HtmlStep|Doc)*,NodeArgs) >
<!ATTLIST HtmlStep rID ID #REQUIRED >

<!ELEMENT Obj ( #PCDATA ) >
<!ATTLIST Obj plainTxt (False|True) "True">

<!ELEMENT Details ( #PCDATA ) >
<!ATTLIST Details plainTxt (False|True) "True">

<!ELEMENT Time ( #PCDATA ) >

<!ELEMENT HTML ( #PCDATA ) >

<!ELEMENT Disp ( #PCDATA ) >

<!ELEMENT TimeTick ( #PCDATA ) >

<!ELEMENT DataMapping ( DataMappedItem* )>
<!ELEMENT DataMappedItem EMPTY >
<!ATTLIST DataMappedItem dsName CDATA #REQUIRED >
<!ATTLIST DataMappedItem rowId CDATA #REQUIRED >

<!ELEMENT NodeArgs (Disp,TopPane?,BtmPane?,ExtendedInfo? )>
<!ATTLIST NodeArgs eType CDATA #REQUIRED icon CDATA #REQUIRED nRep CDATA #REQUIRED UserNote CDATA #IMPLIED filter (False|True) "True">
<!ATTLIST NodeArgs status (Passed|Failed|Done|Warning|Information) "Done">
<!ATTLIST NodeArgs iconSel CDATA #IMPLIED nType CDATA #IMPLIED MovieMarker CDATA "">
<!ATTLIST NodeArgs Source CDATA #IMPLIED SourceLine CDATA #IMPLIED StepFlowItemKey CDATA #IMPLIED >

<!ELEMENT TopPane (Path)>

<!ELEMENT BtmPane ( (Path|WR)?,ASHilite?)>
<!ATTLIST BtmPane vType CDATA "HTML">

<!ELEMENT Path ( #PCDATA ) >

<!ELEMENT ASHilite ( #PCDATA ) >

<!ELEMENT WR ( #PCDATA ) >

<!ELEMENT ExtendedInfo ( StepData ) >

<!ATTLIST ExtendedInfo StepType CDATA #REQUIRED>
<!ELEMENT DT (NodeArgs) >
<!ATTLIST DT rID ID #REQUIRED>

<!ELEMENT Summary (Param*)>
<!ATTLIST Summary sTime CDATA #IMPLIED eTime CDATA #IMPLIED passed CDATA #IMPLIED failed CDATA #IMPLIED warnings CDATA #IMPLIED retval CDATA #IMPLIED stopped (False|True) "False" >

<!ELEMENT Param (ParamName,ParamVal)+ >
<!ATTLIST Param paramInOut (In|Out) "In">

<!ELEMENT ParamName ( #PCDATA ) >

<!ELEMENT ParamVal ( #PCDATA ) >

]
>
<Report ver="2.0" tmZone="India Standard Time">
<General productName="HPE Unified Functional Testing" productVer="14.03" os="" host="LIN33004137"><DocLocation><![CDATA[C:\framework\QTP-Hybrid-Framework\QTP-Hybrid-Framework\TestCases\payback_1]]></DocLocation></General>
<Doc rID="T1"   productName= "HPE Unified Functional Testing"  >
<DName><![CDATA[payback_1]]></DName>
<Res><![CDATA[Res16]]></Res>
<DT rID="T2">
<NodeArgs eType="Table" icon="2" nRep="4" filter="False" >
<Disp><![CDATA[Run-Time Data Table]]></Disp>
<BtmPane vType="Table" >
<Path><![CDATA[Default.xls]]></Path>
</BtmPane>
</NodeArgs>
</DT>
<DIter rID="T3" iterID="1" >
<Action rID="T4">
<AName><![CDATA[Action1]]></AName>
<Step rID="T5">
<Obj plainTxt="False" ><![CDATA[Largest Multi-brand Loyalty_2]]></Obj>
<Details plainTxt="False" ><![CDATA[<table><tr><td><span style="text-align : left; font-size : 12px; ">Local Browser</span></td></tr></table>]]></Details>
<Time><![CDATA[14-02-2023 - 11:07:50]]></Time>
<TimeTick>1676353070</TimeTick>
<Step rID="T6">
<Obj plainTxt="False" ><![CDATA[Largest Multi-brand Loyalty]]></Obj>
<Details plainTxt="False" ><![CDATA[Page]]></Details>
<Time><![CDATA[14-02-2023 - 11:07:50]]></Time>
<TimeTick>1676353070</TimeTick>
<Step rID="T7">
<Obj plainTxt="False" ><![CDATA[Login.Click]]></Obj>
<Details plainTxt="False" ><![CDATA[]]></Details>
<Time><![CDATA[14-02-2023 - 11:07:50]]></Time>
<TimeTick>1676353070</TimeTick>
<NodeArgs eType="Replay" icon="7" nRep="12" Source="Action1" SourceLine="1" >
<Disp><![CDATA[Login.Click]]></Disp>
</NodeArgs>
</Step>
<NodeArgs eType="Context" icon="6" nRep="11" Source="Action1" SourceLine="1" >
<Disp><![CDATA[Largest Multi-brand Loyalty]]></Disp>
</NodeArgs>
</Step>
<Step rID="T8">
<Obj plainTxt="False" ><![CDATA[Login to your PAYBACK]]></Obj>
<Details plainTxt="False" ><![CDATA[Page]]></Details>
<Time><![CDATA[14-02-2023 - 11:07:51]]></Time>
<TimeTick>1676353071</TimeTick>
<Step rID="T9">
<Obj plainTxt="False" ><![CDATA[card_number.Set]]></Obj>
<Details plainTxt="False" ><![CDATA["7995759682"]]></Details>
<Time><![CDATA[14-02-2023 - 11:07:51]]></Time>
<TimeTick>1676353071</TimeTick>
<NodeArgs eType="Replay" icon="8" nRep="17" Source="Action1" SourceLine="2" >
<Disp><![CDATA[card_number.Set]]></Disp>
</NodeArgs>
</Step>
<Step rID="T10">
<Obj plainTxt="False" ><![CDATA[pin_number.Set]]></Obj>
<Details plainTxt="False" ><![CDATA["63eb074f86ee1193e3996159b654"]]></Details>
<Time><![CDATA[14-02-2023 - 11:07:52]]></Time>
<TimeTick>1676353072</TimeTick>
<NodeArgs eType="Replay" icon="8" nRep="20" Source="Action1" SourceLine="3" >
<Disp><![CDATA[pin_number.Set]]></Disp>
</NodeArgs>
</Step>
<NodeArgs eType="Context" icon="6" nRep="16" Source="Action1" SourceLine="2" >
<Disp><![CDATA[Login to your PAYBACK]]></Disp>
</NodeArgs>
</Step>
<Step rID="T11">
<Obj plainTxt="False" ><![CDATA[Largest Multi-brand Loyalty]]></Obj>
<Details plainTxt="False" ><![CDATA[Page]]></Details>
<Time><![CDATA[14-02-2023 - 11:07:52]]></Time>
<TimeTick>1676353072</TimeTick>
<Step rID="T12">
<Obj plainTxt="False" ><![CDATA[Customer Care.Click]]></Obj>
<Details plainTxt="False" ><![CDATA[]]></Details>
<Time><![CDATA[14-02-2023 - 11:07:52]]></Time>
<TimeTick>1676353072</TimeTick>
<NodeArgs eType="Replay" icon="7" nRep="24" Source="Action1" SourceLine="6" >
<Disp><![CDATA[Customer Care.Click]]></Disp>
</NodeArgs>
</Step>
<NodeArgs eType="Context" icon="6" nRep="23" Source="Action1" SourceLine="6" >
<Disp><![CDATA[Largest Multi-brand Loyalty]]></Disp>
</NodeArgs>
</Step>
<Step rID="T13">
<Obj plainTxt="False" ><![CDATA[FAQs: Customer Care Queries]]></Obj>
<Details plainTxt="False" ><![CDATA[Page]]></Details>
<Time><![CDATA[14-02-2023 - 11:07:53]]></Time>
<TimeTick>1676353073</TimeTick>
<Step rID="T14">
<Obj plainTxt="False" ><![CDATA[What are the benefits.Click]]></Obj>
<Details plainTxt="False" ><![CDATA[]]></Details>
<Time><![CDATA[14-02-2023 - 11:07:53]]></Time>
<TimeTick>1676353073</TimeTick>
<NodeArgs eType="Replay" icon="9" nRep="28" Source="Action1" SourceLine="7" >
<Disp><![CDATA[What are the benefits.Click]]></Disp>
</NodeArgs>
</Step>
<Step rID="T15">
<Obj plainTxt="False" ><![CDATA[What is the eligibility.Click]]></Obj>
<Details plainTxt="False" ><![CDATA[]]></Details>
<Time><![CDATA[14-02-2023 - 11:07:54]]></Time>
<TimeTick>1676353074</TimeTick>
<NodeArgs eType="Replay" icon="9" nRep="31" Source="Action1" SourceLine="8" >
<Disp><![CDATA[What is the eligibility.Click]]></Disp>
</NodeArgs>
</Step>
<Step rID="T16">
<Obj plainTxt="False" ><![CDATA[Who are PAYBACK partners?.Click]]></Obj>
<Details plainTxt="False" ><![CDATA[]]></Details>
<Time><![CDATA[14-02-2023 - 11:07:54]]></Time>
<TimeTick>1676353074</TimeTick>
<NodeArgs eType="Replay" icon="9" nRep="34" Source="Action1" SourceLine="9" >
<Disp><![CDATA[Who are PAYBACK partners?.Click]]></Disp>
</NodeArgs>
</Step>
<Step rID="T17">
<Obj plainTxt="False" ><![CDATA[How can I locate the store.Click]]></Obj>
<Details plainTxt="False" ><![CDATA[]]></Details>
<Time><![CDATA[14-02-2023 - 11:07:54]]></Time>
<TimeTick>1676353074</TimeTick>
<NodeArgs eType="Replay" icon="9" nRep="37" Source="Action1" SourceLine="10" >
<Disp><![CDATA[How can I locate the store.Click]]></Disp>
</NodeArgs>
</Step>
<Step rID="T18">
<Obj plainTxt="False" ><![CDATA[What is the number of.Click]]></Obj>
<Details plainTxt="False" ><![CDATA[]]></Details>
<Time><![CDATA[14-02-2023 - 11:07:54]]></Time>
<TimeTick>1676353074</TimeTick>
<NodeArgs eType="Replay" icon="9" nRep="40" Source="Action1" SourceLine="11" >
<Disp><![CDATA[What is the number of.Click]]></Disp>
</NodeArgs>
</Step>
<Step rID="T19">
<Obj plainTxt="False" ><![CDATA[How can I enrol into PAYBACK.Click]]></Obj>
<Details plainTxt="False" ><![CDATA[]]></Details>
<Time><![CDATA[14-02-2023 - 11:07:54]]></Time>
<TimeTick>1676353074</TimeTick>
<NodeArgs eType="Replay" icon="9" nRep="43" Source="Action1" SourceLine="12" >
<Disp><![CDATA[How can I enrol into PAYBACK.Click]]></Disp>
</NodeArgs>
</Step>
<Step rID="T20">
<Obj plainTxt="False" ><![CDATA[toggleTabCollapse.Select]]></Obj>
<Details plainTxt="False" ><![CDATA["ABOUT PAYBACK"]]></Details>
<Time><![CDATA[14-02-2023 - 11:07:55]]></Time>
<TimeTick>1676353075</TimeTick>
<NodeArgs eType="Replay" icon="10" nRep="46" Source="Action1" SourceLine="13" >
<Disp><![CDATA[toggleTabCollapse.Select]]></Disp>
</NodeArgs>
</Step>
<Step rID="T21">
<Obj plainTxt="False" ><![CDATA[How long is my PAYBACK.Click]]></Obj>
<Details plainTxt="False" ><![CDATA[]]></Details>
<Time><![CDATA[14-02-2023 - 11:07:55]]></Time>
<TimeTick>1676353075</TimeTick>
<NodeArgs eType="Replay" icon="9" nRep="49" Source="Action1" SourceLine="14" >
<Disp><![CDATA[How long is my PAYBACK.Click]]></Disp>
</NodeArgs>
</Step>
<Step rID="T22">
<Obj plainTxt="False" ><![CDATA[What information is available.Click]]></Obj>
<Details plainTxt="False" ><![CDATA[]]></Details>
<Time><![CDATA[14-02-2023 - 11:07:55]]></Time>
<TimeTick>1676353075</TimeTick>
<NodeArgs eType="Replay" icon="9" nRep="52" Source="Action1" SourceLine="15" >
<Disp><![CDATA[What information is available.Click]]></Disp>
</NodeArgs>
</Step>
<Step rID="T23">
<Obj plainTxt="False" ><![CDATA[I did not receive my PAYBACK.Click]]></Obj>
<Details plainTxt="False" ><![CDATA[]]></Details>
<Time><![CDATA[14-02-2023 - 11:07:55]]></Time>
<TimeTick>1676353075</TimeTick>
<NodeArgs eType="Replay" icon="9" nRep="55" Source="Action1" SourceLine="16" >
<Disp><![CDATA[I did not receive my PAYBACK.Click]]></Disp>
</NodeArgs>
</Step>
<Step rID="T24">
<Obj plainTxt="False" ><![CDATA[What happens if I lose.Click]]></Obj>
<Details plainTxt="False" ><![CDATA[]]></Details>
<Time><![CDATA[14-02-2023 - 11:07:55]]></Time>
<TimeTick>1676353075</TimeTick>
<NodeArgs eType="Replay" icon="9" nRep="58" Source="Action1" SourceLine="17" >
<Disp><![CDATA[What happens if I lose.Click]]></Disp>
</NodeArgs>
</Step>
<Step rID="T25">
<Obj plainTxt="False" ><![CDATA[Can I get a replacement.Click]]></Obj>
<Details plainTxt="False" ><![CDATA[]]></Details>
<Time><![CDATA[14-02-2023 - 11:07:55]]></Time>
<TimeTick>1676353075</TimeTick>
<NodeArgs eType="Replay" icon="9" nRep="61" Source="Action1" SourceLine="18" >
<Disp><![CDATA[Can I get a replacement.Click]]></Disp>
</NodeArgs>
</Step>
<Step rID="T26">
<Obj plainTxt="False" ><![CDATA[Can I get a replacement_2.Click]]></Obj>
<Details plainTxt="False" ><![CDATA[]]></Details>
<Time><![CDATA[14-02-2023 - 11:07:55]]></Time>
<TimeTick>1676353075</TimeTick>
<NodeArgs eType="Replay" icon="9" nRep="64" Source="Action1" SourceLine="19" >
<Disp><![CDATA[Can I get a replacement_2.Click]]></Disp>
</NodeArgs>
</Step>
<Step rID="T27">
<Obj plainTxt="False" ><![CDATA[toggleTabCollapse.Select]]></Obj>
<Details plainTxt="False" ><![CDATA["PAYBACK CARD INFORMATION"]]></Details>
<Time><![CDATA[14-02-2023 - 11:07:55]]></Time>
<TimeTick>1676353075</TimeTick>
<NodeArgs eType="Replay" icon="10" nRep="67" Source="Action1" SourceLine="20" >
<Disp><![CDATA[toggleTabCollapse.Select]]></Disp>
</NodeArgs>
</Step>
<Step rID="T28">
<Obj plainTxt="False" ><![CDATA[What is the benefit of.Click]]></Obj>
<Details plainTxt="False" ><![CDATA[]]></Details>
<Time><![CDATA[14-02-2023 - 11:07:56]]></Time>
<TimeTick>1676353076</TimeTick>
<NodeArgs eType="Replay" icon="9" nRep="70" Source="Action1" SourceLine="21" >
<Disp><![CDATA[What is the benefit of.Click]]></Disp>
</NodeArgs>
</Step>
<Step rID="T29">
<Obj plainTxt="False" ><![CDATA[If I have multiple PAYBACK.Click]]></Obj>
<Details plainTxt="False" ><![CDATA[]]></Details>
<Time><![CDATA[14-02-2023 - 11:07:56]]></Time>
<TimeTick>1676353076</TimeTick>
<NodeArgs eType="Replay" icon="9" nRep="73" Source="Action1" SourceLine="22" >
<Disp><![CDATA[If I have multiple PAYBACK.Click]]></Disp>
</NodeArgs>
</Step>
<Step rID="T30">
<Obj plainTxt="False" ><![CDATA[How to update my account.Click]]></Obj>
<Details plainTxt="False" ><![CDATA[]]></Details>
<Time><![CDATA[14-02-2023 - 11:07:56]]></Time>
<TimeTick>1676353076</TimeTick>
<NodeArgs eType="Replay" icon="9" nRep="76" Source="Action1" SourceLine="23" >
<Disp><![CDATA[How to update my account.Click]]></Disp>
</NodeArgs>
</Step>
<Step rID="T31">
<Obj plainTxt="False" ><![CDATA[How can I change my existing.Click]]></Obj>
<Details plainTxt="False" ><![CDATA[]]></Details>
<Time><![CDATA[14-02-2023 - 11:07:56]]></Time>
<TimeTick>1676353076</TimeTick>
<NodeArgs eType="Replay" icon="9" nRep="79" Source="Action1" SourceLine="24" >
<Disp><![CDATA[How can I change my existing.Click]]></Disp>
</NodeArgs>
</Step>
<Step rID="T32">
<Obj plainTxt="False" ><![CDATA[Can I transfer my PAYBACK.Click]]></Obj>
<Details plainTxt="False" ><![CDATA[]]></Details>
<Time><![CDATA[14-02-2023 - 11:07:56]]></Time>
<TimeTick>1676353076</TimeTick>
<NodeArgs eType="Replay" icon="9" nRep="82" Source="Action1" SourceLine="25" >
<Disp><![CDATA[Can I transfer my PAYBACK.Click]]></Disp>
</NodeArgs>
</Step>
<Step rID="T33">
<Obj plainTxt="False" ><![CDATA[What happens to the PAYBACK.Click]]></Obj>
<Details plainTxt="False" ><![CDATA[]]></Details>
<Time><![CDATA[14-02-2023 - 11:07:56]]></Time>
<TimeTick>1676353076</TimeTick>
<NodeArgs eType="Replay" icon="9" nRep="85" Source="Action1" SourceLine="26" >
<Disp><![CDATA[What happens to the PAYBACK.Click]]></Disp>
</NodeArgs>
</Step>
<Step rID="T34">
<Obj plainTxt="False" ><![CDATA[How can I cancel my PAYBACK.Click]]></Obj>
<Details plainTxt="False" ><![CDATA[]]></Details>
<Time><![CDATA[14-02-2023 - 11:07:56]]></Time>
<TimeTick>1676353076</TimeTick>
<NodeArgs eType="Replay" icon="9" nRep="88" Source="Action1" SourceLine="27" >
<Disp><![CDATA[How can I cancel my PAYBACK.Click]]></Disp>
</NodeArgs>
</Step>
<Step rID="T35">
<Obj plainTxt="False" ><![CDATA[How to reactivate my account?.Click]]></Obj>
<Details plainTxt="False" ><![CDATA[]]></Details>
<Time><![CDATA[14-02-2023 - 11:07:56]]></Time>
<TimeTick>1676353076</TimeTick>
<NodeArgs eType="Replay" icon="9" nRep="91" Source="Action1" SourceLine="28" >
<Disp><![CDATA[How to reactivate my account?.Click]]></Disp>
</NodeArgs>
</Step>
<Step rID="T36">
<Obj plainTxt="False" ><![CDATA[toggleTabCollapse.Select]]></Obj>
<Details plainTxt="False" ><![CDATA["ACCOUNT INFORMATION"]]></Details>
<Time><![CDATA[14-02-2023 - 11:07:57]]></Time>
<TimeTick>1676353077</TimeTick>
<NodeArgs eType="Replay" icon="10" nRep="94" Source="Action1" SourceLine="29" >
<Disp><![CDATA[toggleTabCollapse.Select]]></Disp>
</NodeArgs>
</Step>
<Step rID="T37">
<Obj plainTxt="False" ><![CDATA[How can I redeem my PAYBACK.Click]]></Obj>
<Details plainTxt="False" ><![CDATA[]]></Details>
<Time><![CDATA[14-02-2023 - 11:07:57]]></Time>
<TimeTick>1676353077</TimeTick>
<NodeArgs eType="Replay" icon="9" nRep="97" Source="Action1" SourceLine="30" >
<Disp><![CDATA[How can I redeem my PAYBACK.Click]]></Disp>
</NodeArgs>
</Step>
<Step rID="T38">
<Obj plainTxt="False" ><![CDATA[How can I keep a track.Click]]></Obj>
<Details plainTxt="False" ><![CDATA[]]></Details>
<Time><![CDATA[14-02-2023 - 11:07:57]]></Time>
<TimeTick>1676353077</TimeTick>
<NodeArgs eType="Replay" icon="9" nRep="100" Source="Action1" SourceLine="31" >
<Disp><![CDATA[How can I keep a track.Click]]></Disp>
</NodeArgs>
</Step>
<Step rID="T39">
<Obj plainTxt="False" ><![CDATA[Can I use my PAYBACK Points.Click]]></Obj>
<Details plainTxt="False" ><![CDATA[]]></Details>
<Time><![CDATA[14-02-2023 - 11:07:57]]></Time>
<TimeTick>1676353077</TimeTick>
<NodeArgs eType="Replay" icon="9" nRep="103" Source="Action1" SourceLine="32" >
<Disp><![CDATA[Can I use my PAYBACK Points.Click]]></Disp>
</NodeArgs>
</Step>
<Step rID="T40">
<Obj plainTxt="False" ><![CDATA[My PAYBACK Points have.Click]]></Obj>
<Details plainTxt="False" ><![CDATA[]]></Details>
<Time><![CDATA[14-02-2023 - 11:07:57]]></Time>
<TimeTick>1676353077</TimeTick>
<NodeArgs eType="Replay" icon="9" nRep="106" Source="Action1" SourceLine="33" >
<Disp><![CDATA[My PAYBACK Points have.Click]]></Disp>
</NodeArgs>
</Step>
<Step rID="T41">
<Obj plainTxt="False" ><![CDATA[When will my PAYBACK Points.Click]]></Obj>
<Details plainTxt="False" ><![CDATA[]]></Details>
<Time><![CDATA[14-02-2023 - 11:07:57]]></Time>
<TimeTick>1676353077</TimeTick>
<NodeArgs eType="Replay" icon="9" nRep="109" Source="Action1" SourceLine="34" >
<Disp><![CDATA[When will my PAYBACK Points.Click]]></Disp>
</NodeArgs>
</Step>
<Step rID="T42">
<Obj plainTxt="False" ><![CDATA[Is there a limit on earning.Click]]></Obj>
<Details plainTxt="False" ><![CDATA[]]></Details>
<Time><![CDATA[14-02-2023 - 11:07:57]]></Time>
<TimeTick>1676353077</TimeTick>
<NodeArgs eType="Replay" icon="9" nRep="112" Source="Action1" SourceLine="35" >
<Disp><![CDATA[Is there a limit on earning.Click]]></Disp>
</NodeArgs>
</Step>
<Step rID="T43">
<Obj plainTxt="False" ><![CDATA[toggleTabCollapse.Select]]></Obj>
<Details plainTxt="False" ><![CDATA["POINTS INFORMATION"]]></Details>
<Time><![CDATA[14-02-2023 - 11:07:58]]></Time>
<TimeTick>1676353078</TimeTick>
<NodeArgs eType="Replay" icon="10" nRep="115" Source="Action1" SourceLine="36" >
<Disp><![CDATA[toggleTabCollapse.Select]]></Disp>
</NodeArgs>
</Step>
<Step rID="T44">
<Obj plainTxt="False" ><![CDATA[You can choose your favourite.Click]]></Obj>
<Details plainTxt="False" ><![CDATA[]]></Details>
<Time><![CDATA[14-02-2023 - 11:07:58]]></Time>
<TimeTick>1676353078</TimeTick>
<NodeArgs eType="Replay" icon="9" nRep="118" Source="Action1" SourceLine="37" >
<Disp><![CDATA[You can choose your favourite.Click]]></Disp>
</NodeArgs>
</Step>
<Step rID="T45">
<Obj plainTxt="False" ><![CDATA[How long will it take.Click]]></Obj>
<Details plainTxt="False" ><![CDATA[]]></Details>
<Time><![CDATA[14-02-2023 - 11:07:58]]></Time>
<TimeTick>1676353078</TimeTick>
<NodeArgs eType="Replay" icon="9" nRep="121" Source="Action1" SourceLine="38" >
<Disp><![CDATA[How long will it take.Click]]></Disp>
</NodeArgs>
</Step>
<Step rID="T46">
<Obj plainTxt="False" ><![CDATA[What if incase I receive.Click]]></Obj>
<Details plainTxt="False" ><![CDATA[]]></Details>
<Time><![CDATA[14-02-2023 - 11:07:58]]></Time>
<TimeTick>1676353078</TimeTick>
<NodeArgs eType="Replay" icon="9" nRep="124" Source="Action1" SourceLine="39" >
<Disp><![CDATA[What if incase I receive.Click]]></Disp>
</NodeArgs>
</Step>
<Step rID="T47">
<Obj plainTxt="False" ><![CDATA[I am a Jet Privilege Miles.Click]]></Obj>
<Details plainTxt="False" ><![CDATA[]]></Details>
<Time><![CDATA[14-02-2023 - 11:07:58]]></Time>
<TimeTick>1676353078</TimeTick>
<NodeArgs eType="Replay" icon="9" nRep="127" Source="Action1" SourceLine="40" >
<Disp><![CDATA[I am a Jet Privilege Miles.Click]]></Disp>
</NodeArgs>
</Step>
<Step rID="T48">
<Obj plainTxt="False" ><![CDATA[I am a Miles & More member..Click]]></Obj>
<Details plainTxt="False" ><![CDATA[]]></Details>
<Time><![CDATA[14-02-2023 - 11:07:58]]></Time>
<TimeTick>1676353078</TimeTick>
<NodeArgs eType="Replay" icon="9" nRep="130" Source="Action1" SourceLine="41" >
<Disp><![CDATA[I am a Miles & More member..Click]]></Disp>
</NodeArgs>
</Step>
<Step rID="T49">
<Obj plainTxt="False" ><![CDATA[Can I cancel my redemption.Click]]></Obj>
<Details plainTxt="False" ><![CDATA[]]></Details>
<Time><![CDATA[14-02-2023 - 11:07:58]]></Time>
<TimeTick>1676353078</TimeTick>
<NodeArgs eType="Replay" icon="9" nRep="133" Source="Action1" SourceLine="42" >
<Disp><![CDATA[Can I cancel my redemption.Click]]></Disp>
</NodeArgs>
</Step>
<Step rID="T50">
<Obj plainTxt="False" ><![CDATA[Can I request the product.Click]]></Obj>
<Details plainTxt="False" ><![CDATA[]]></Details>
<Time><![CDATA[14-02-2023 - 11:07:58]]></Time>
<TimeTick>1676353078</TimeTick>
<NodeArgs eType="Replay" icon="9" nRep="136" Source="Action1" SourceLine="43" >
<Disp><![CDATA[Can I request the product.Click]]></Disp>
</NodeArgs>
</Step>
<Step rID="T51">
<Obj plainTxt="False" ><![CDATA[toggleTabCollapse.Select]]></Obj>
<Details plainTxt="False" ><![CDATA["REDEMPTION INFORMATION"]]></Details>
<Time><![CDATA[14-02-2023 - 11:07:58]]></Time>
<TimeTick>1676353078</TimeTick>
<NodeArgs eType="Replay" icon="10" nRep="139" Source="Action1" SourceLine="44" >
<Disp><![CDATA[toggleTabCollapse.Select]]></Disp>
</NodeArgs>
</Step>
<Step rID="T52">
<Obj plainTxt="False" ><![CDATA[An eCoupon is a special.Click]]></Obj>
<Details plainTxt="False" ><![CDATA[]]></Details>
<Time><![CDATA[14-02-2023 - 11:07:59]]></Time>
<TimeTick>1676353079</TimeTick>
<NodeArgs eType="Replay" icon="9" nRep="142" Source="Action1" SourceLine="45" >
<Disp><![CDATA[An eCoupon is a special.Click]]></Disp>
</NodeArgs>
</Step>
<Step rID="T53">
<Obj plainTxt="False" ><![CDATA[How do I use an eCoupon?.Click]]></Obj>
<Details plainTxt="False" ><![CDATA[]]></Details>
<Time><![CDATA[14-02-2023 - 11:07:59]]></Time>
<TimeTick>1676353079</TimeTick>
<NodeArgs eType="Replay" icon="9" nRep="145" Source="Action1" SourceLine="46" >
<Disp><![CDATA[How do I use an eCoupon?.Click]]></Disp>
</NodeArgs>
</Step>
<Step rID="T54">
<Obj plainTxt="False" ><![CDATA[How do I use an eCoupon?_2.Click]]></Obj>
<Details plainTxt="False" ><![CDATA[]]></Details>
<Time><![CDATA[14-02-2023 - 11:07:59]]></Time>
<TimeTick>1676353079</TimeTick>
<NodeArgs eType="Replay" icon="9" nRep="148" Source="Action1" SourceLine="47" >
<Disp><![CDATA[How do I use an eCoupon?_2.Click]]></Disp>
</NodeArgs>
</Step>
<Step rID="T55">
<Obj plainTxt="False" ><![CDATA[How is an eCoupon different.Click]]></Obj>
<Details plainTxt="False" ><![CDATA[]]></Details>
<Time><![CDATA[14-02-2023 - 11:07:59]]></Time>
<TimeTick>1676353079</TimeTick>
<NodeArgs eType="Replay" icon="9" nRep="151" Source="Action1" SourceLine="48" >
<Disp><![CDATA[How is an eCoupon different.Click]]></Disp>
</NodeArgs>
</Step>
<Step rID="T56">
<Obj plainTxt="False" ><![CDATA[Can I pass on my eCoupons.Click]]></Obj>
<Details plainTxt="False" ><![CDATA[]]></Details>
<Time><![CDATA[14-02-2023 - 11:07:59]]></Time>
<TimeTick>1676353079</TimeTick>
<NodeArgs eType="Replay" icon="9" nRep="154" Source="Action1" SourceLine="49" >
<Disp><![CDATA[Can I pass on my eCoupons.Click]]></Disp>
</NodeArgs>
</Step>
<Step rID="T57">
<Obj plainTxt="False" ><![CDATA[Where can I use my eCoupon?.Click]]></Obj>
<Details plainTxt="False" ><![CDATA[]]></Details>
<Time><![CDATA[14-02-2023 - 11:07:59]]></Time>
<TimeTick>1676353079</TimeTick>
<NodeArgs eType="Replay" icon="9" nRep="157" Source="Action1" SourceLine="50" >
<Disp><![CDATA[Where can I use my eCoupon?.Click]]></Disp>
</NodeArgs>
</Step>
<Step rID="T58">
<Obj plainTxt="False" ><![CDATA[Can I use the same eCoupon.Click]]></Obj>
<Details plainTxt="False" ><![CDATA[]]></Details>
<Time><![CDATA[14-02-2023 - 11:07:59]]></Time>
<TimeTick>1676353079</TimeTick>
<NodeArgs eType="Replay" icon="9" nRep="160" Source="Action1" SourceLine="51" >
<Disp><![CDATA[Can I use the same eCoupon.Click]]></Disp>
</NodeArgs>
</Step>
<Step rID="T59">
<Obj plainTxt="False" ><![CDATA[How long is an eCoupon.Click]]></Obj>
<Details plainTxt="False" ><![CDATA[]]></Details>
<Time><![CDATA[14-02-2023 - 11:08:00]]></Time>
<TimeTick>1676353080</TimeTick>
<NodeArgs eType="Replay" icon="9" nRep="163" Source="Action1" SourceLine="52" >
<Disp><![CDATA[How long is an eCoupon.Click]]></Disp>
</NodeArgs>
</Step>
<Step rID="T60">
<Obj plainTxt="False" ><![CDATA[When will the points be.Click]]></Obj>
<Details plainTxt="False" ><![CDATA[]]></Details>
<Time><![CDATA[14-02-2023 - 11:08:00]]></Time>
<TimeTick>1676353080</TimeTick>
<NodeArgs eType="Replay" icon="9" nRep="166" Source="Action1" SourceLine="53" >
<Disp><![CDATA[When will the points be.Click]]></Disp>
</NodeArgs>
</Step>
<Step rID="T61">
<Obj plainTxt="False" ><![CDATA[Can I club this eCoupon.Click]]></Obj>
<Details plainTxt="False" ><![CDATA[]]></Details>
<Time><![CDATA[14-02-2023 - 11:08:00]]></Time>
<TimeTick>1676353080</TimeTick>
<NodeArgs eType="Replay" icon="9" nRep="169" Source="Action1" SourceLine="54" >
<Disp><![CDATA[Can I club this eCoupon.Click]]></Disp>
</NodeArgs>
</Step>
<Step rID="T62">
<Obj plainTxt="False" ><![CDATA[toggleTabCollapse.Select]]></Obj>
<Details plainTxt="False" ><![CDATA["BONUS COUPONS INFORMATION"]]></Details>
<Time><![CDATA[14-02-2023 - 11:08:00]]></Time>
<TimeTick>1676353080</TimeTick>
<NodeArgs eType="Replay" icon="10" nRep="172" Source="Action1" SourceLine="55" >
<Disp><![CDATA[toggleTabCollapse.Select]]></Disp>
</NodeArgs>
</Step>
<Step rID="T63">
<Obj plainTxt="False" ><![CDATA[toggleTabCollapse.Select]]></Obj>
<Details plainTxt="False" ><![CDATA["PAYBACK PLUS INFORMATION"]]></Details>
<Time><![CDATA[14-02-2023 - 11:08:00]]></Time>
<TimeTick>1676353080</TimeTick>
<NodeArgs eType="Replay" icon="10" nRep="175" Source="Action1" SourceLine="56" >
<Disp><![CDATA[toggleTabCollapse.Select]]></Disp>
</NodeArgs>
</Step>
<Step rID="T64">
<Obj plainTxt="False" ><![CDATA[category.Select]]></Obj>
<Details plainTxt="False" ><![CDATA["Merge PAYBACK points to one card"]]></Details>
<Time><![CDATA[14-02-2023 - 11:08:00]]></Time>
<TimeTick>1676353080</TimeTick>
<NodeArgs eType="Replay" icon="11" nRep="178" Source="Action1" SourceLine="57" >
<Disp><![CDATA[category.Select]]></Disp>
</NodeArgs>
</Step>
<Step rID="T65">
<Obj plainTxt="False" ><![CDATA[card_retained.Set]]></Obj>
<Details plainTxt="False" ><![CDATA["7995758545"]]></Details>
<Time><![CDATA[14-02-2023 - 11:08:00]]></Time>
<TimeTick>1676353080</TimeTick>
<NodeArgs eType="Replay" icon="8" nRep="181" Source="Action1" SourceLine="58" >
<Disp><![CDATA[card_retained.Set]]></Disp>
</NodeArgs>
</Step>
<Step rID="T66">
<Obj plainTxt="False" ><![CDATA[card_retained.Set]]></Obj>
<Details plainTxt="False" ><![CDATA["7995758545643579"]]></Details>
<Time><![CDATA[14-02-2023 - 11:08:01]]></Time>
<TimeTick>1676353081</TimeTick>
<NodeArgs eType="Replay" icon="8" nRep="184" Source="Action1" SourceLine="59" >
<Disp><![CDATA[card_retained.Set]]></Disp>
</NodeArgs>
</Step>
<Step rID="T67">
<Obj plainTxt="False" ><![CDATA[card_cancelled.Set]]></Obj>
<Details plainTxt="False" ><![CDATA["3699543678895435"]]></Details>
<Time><![CDATA[14-02-2023 - 11:08:01]]></Time>
<TimeTick>1676353081</TimeTick>
<NodeArgs eType="Replay" icon="8" nRep="187" Source="Action1" SourceLine="60" >
<Disp><![CDATA[card_cancelled.Set]]></Disp>
</NodeArgs>
</Step>
<Step rID="T68">
<Obj plainTxt="False" ><![CDATA[query_feedback.Set]]></Obj>
<Details plainTxt="False" ><![CDATA["merge points"]]></Details>
<Time><![CDATA[14-02-2023 - 11:08:01]]></Time>
<TimeTick>1676353081</TimeTick>
<NodeArgs eType="Replay" icon="8" nRep="190" Source="Action1" SourceLine="61" >
<Disp><![CDATA[query_feedback.Set]]></Disp>
</NodeArgs>
</Step>
<Step rID="T69">
<Obj plainTxt="False" ><![CDATA[Submit.Click]]></Obj>
<Details plainTxt="False" ><![CDATA[]]></Details>
<Time><![CDATA[14-02-2023 - 11:08:01]]></Time>
<TimeTick>1676353081</TimeTick>
<NodeArgs eType="Replay" icon="9" nRep="193" Source="Action1" SourceLine="62" >
<Disp><![CDATA[Submit.Click]]></Disp>
</NodeArgs>
</Step>
<Step rID="T70">
<Obj plainTxt="False" ><![CDATA[Submit.Click]]></Obj>
<Details plainTxt="False" ><![CDATA[]]></Details>
<Time><![CDATA[14-02-2023 - 11:08:02]]></Time>
<TimeTick>1676353082</TimeTick>
<NodeArgs eType="Replay" icon="12" nRep="196" Source="Action1" SourceLine="63" >
<Disp><![CDATA[Submit.Click]]></Disp>
</NodeArgs>
</Step>
<Step rID="T71">